{
  "schema_version": "1.0",
  "description": "创建人物交互引导数据（机器规格）——各轮询问模板与正反例素材。轮次结构/分支判断/写入规则保留在 SKILL.md（规则性内容），本文件提供询问文案与示例数据。按需读取，不常驻 SKILL.md。",
  "rounds": {
    "r1_basic": {
      "title": "第一轮 — 基础信息",
      "prompt": "👤 人物基础信息\n\n  • 人物类别？（主要角色 / 次要角色 / 龙套角色）\n  • 人物名称？\n  • 性别？（男 / 女 / 无）"
    },
    "volume_assignment": {
      "title": "分卷赋值（条件触发）",
      "prompt": "📚 本书已分 {N} 卷（{卷1名} / {卷2名} / ...）。\n\n「{人物名称}」在哪（几）卷出场？\n  • 第1卷  • 第2卷  • 第3卷  （可多选）\n  • 全卷 — 该角色贯穿全书\n  • 暂不确定 — 先不填，后续再补"
    },
    "r2_appearance": {
      "title": "第二轮 — 外貌信息",
      "prompt": "📐 外貌信息\n\n  • 年龄 / 出生日期？\n  • 身高？（___cm）\n  • 体重？（___kg）\n  • 身形特点？（如：纤细/魁梧、肩宽腰窄、梨形身材 等）"
    },
    "r3_personality": {
      "title": "第三轮 — 内在设定",
      "prompt": "🧠 人物性格\n（可描述性格特征、行为习惯、动机驱动。常见参考方向：外向/内向、理性/感性、积极/消极、稳重/冲动 等）"
    },
    "r3_voice": {
      "title": "第三轮附 — 人物语气（基于性格自动生成）",
      "prompt": "🗣️ 人物语气（基于性格自动生成）\n\n  AI 读取角色性格 → 自动推断 → 输出以下语气配置：\n\n  • 说话风格：[简洁有力 / 啰嗦随性 / 文雅含蓄 / 直白奔放 / 其他...]\n  • 用词偏好：[口语化 / 书面化 / 粗犷 / 文绉绉 / 其他...]\n  • 情绪表达：[外放 / 内敛 / 冷静 / 激烈 / 其他...]\n  • 句式特征：[短句为主 / 长句为主 / 碎片化 / 工整 / 其他...]\n  • 口头禅：[有则填，无则留空]\n  {仅当 content_rating=NSFW 时追加：}\n  • nsfw_tone：[保守 / 中性 / 放荡] — 影响 NSFW 场景中该角色的用词尺度\n\n  📝 以上为 AI 根据「{一句话概括性格}」自动生成。是否调整？\n    • 确认 — 直接使用\n    • 修改 — 告诉我需要改哪些维度（如\"说话风格改成话多且密\"\"nsfw_tone改成放荡\"）\n    • 跳过 — 不设置语气（写作时不应用角色语气约束）"
    },
    "r4_background": {
      "title": "第四轮 — 背景故事",
      "prompt": "📖 人物简介\n（角色的出身、经历、在故事中的定位。可以是一段话，也可以简要描述）"
    },
    "r6_nsfw_body": {
      "title": "第六轮 — NSFW 身体设定（仅 NSFW 作品）",
      "prompt": "🔞 NSFW 身体设定（当前作品为 NSFW 类，以下为必填项）\n\n  • XP？（角色性癖/XP标签，如：受虐倾向、控制欲、露出癖 等）\n  • 三维？（胸围_腰围_臀围，如：88_62_90）\n  • 性特征？（性相关身体特征描述，如胸型/下体特征/敏感带 等）"
    },
    "r5_optional": {
      "title": "第五轮 — 可选内容",
      "prompt": "📎 以下均为可选，可跳过任意项：\n\n  • 人物基本关系？（与其他角色的关系——如\"张三与李四：师徒\"）\n  • 人物能力？（对各项能力打分 1-10——战斗/建造/烹饪/农艺/医疗/社交/智识/魔力/魅力）\n  {content_rating=NSFW 时追加：}\n  • 人物X能力？（对X相关能力打分 1-10——耐力/耐受/攻击力/性欲望）"
    },
    "quick_l1": {
      "title": "龙套快速通道 L1 — 确认名称",
      "prompt": "👤 龙套角色名称？"
    },
    "quick_l2": {
      "title": "龙套快速通道 L2 — 一句话描述",
      "prompt": "✏️ 请一句话描述「{人物名称}」\n（含大致年龄、社会身份/地位、身形特点、性格、简单关系等）\n\n例如：\n  \"李四的发小，约25岁，镇上铁匠铺学徒，膀大腰圆，憨厚老实，与李四是酒友。\""
    }
  },
  "examples": {
    "body_shape": [
      { "wrong": "身材很好", "right": "肩宽腰窄，倒三角身材，手臂线条分明" },
      { "wrong": "长得还行", "right": "清瘦修长，锁骨突出，常年不见阳光的苍白肤色" },
      { "wrong": "挺好看的", "right": "娇小圆润，梨形身材，腰细但胯宽，走路带风" }
    ],
    "personality": [
      { "wrong": "他很善良，很勇敢，也很聪明", "right": "表面冷言少语，实则心软——看到受伤的猫会绕路去买药但嘴上说'真麻烦'。不擅交际但极重承诺，答应的事拼了命也会做到。" },
      { "wrong": "性格开朗外向活泼", "right": "话多且密，三句话能把陌生人聊成熟人。喜欢热闹，怕冷场——别人沉默她就紧张，会主动找话题填上。" }
    ],
    "background": [
      { "wrong": "他是个很厉害的人，经历了很多事情", "right": "出身铁匠之家，十岁时村子遭山贼洗劫，父母双亡。被路过的剑客收为弟子，随师学艺八载。十六岁下山，踏上寻找山贼余党的复仇之路——但他更想知道的是，师傅为什么偏偏在那天'路过'。" }
    ]
  }
}
